,date,time,ticker,link,headline,content
0,2020-10-28,20:51:00,AAPL,https://www.investors.com/market-trend/stock-market-today/dow-jones-futures-servicenow-pinterest-earnings-coronavirus-market-rout-apple-amazon-facebook-due/?src=A00220,"Dow Jones Futures Rise After Market Rout, But Will The Rally Survive? All Eyes On Apple, Amazon, Facebook","Dow Jones futures rose solidly late Wednesday, along with S&P 500 futures and Nasdaq futures. The stock market rally came under increasing pressure Wednesday, as stocks sold off on mixed earnings reports, coronavirus cases spurring lockdowns in much of Europe and the looming election.  X  Pinterest (PINS) and ServiceNow earnings offered some hope overnight, giving a lift to several peers. But with the stock market rally reeling, all eyes are on Thursday s earnings tsunami, including Apple stock, Amazon.com (AMZN), Facebook (FB) and Google parent Alphabet (GOOGL).  The Nasdaq composite tumbled through its 50-day line, joining the Dow Jones and S&P 500. Megacap techs, which propped up the Nasdaq on Tuesday, sold off Wednesday. Microsoft (MSFT) fell on mixed earnings. Apple stock sank to a one-month low while the FANG trio Amazon.com, Facebook and Google parent Alphabet fell back below their 50-day averages. Tesla stock and Nvidia (NVDA) closed below their 50-day lines. ServiceNow stock fell, but rebounded from its 50-day. Shopify (SHOP) tumbled toward that key level while Adobe (ADBE) is nearing the low of its base.  The most positive news from Wednesday s session may have been the surge in fear. After barely moving during the late September stock market retreat, the CBOE Volatility Index (CBOE) spiked intraday to its highest level since mid-June, though well off the March summit. The put/call ratio rose to 0.9, which is high but not extreme.  Excessive bearishness often is associated with short-term bottoms. But it doesn t have to happen right away and any bounce doesn t have to last.  Why This IBD Tool Simplifies The Search For Top Stocks  Earnings After Hours  ServiceNow (NOW), Pinterest, Etsy (ETSY), Visa (V), Teladoc Health (TDOC), Livongo (LVGO) and SunPower (SPWR) reported earnings after the close.  ServiceNow rose modestly and Pinterest stock spiked. ServiceNow earnings gave a slight lift to some business software makers after several peers gave weak guidance. Pinterest earnings buoyed soon-to-report Facebook and Twitter stock, which both popped recently on blowout Snap (SNAP) results.  Visa rose modestly following weak Mastercard results. Etsy stock retreated slightly after falling just below a buy point on Wednesday. Teladoc stock and merger partner Livongo retreated as Teladoc forecast a wider fourth-quarter loss. SunPower fell modestly after rallying on sunny First Solar earnings.  Thursday Earnings  Early Thursday, Shopify stock, coronavirus vaccine maker Moderna (MRNA), Idexx Labs (IDXX) and Spotify (SPOT) are on tap.  Then the main event: Apple (AAPL), Amazon stock, Facebook and Google report Thursday night, as well as Twitter (TWTR) and many others.  Tesla (TSLA), Microsoft, Nvidia and ServiceNow stock are on IBD Leaderboard. Microsoft stock, Adobe, ServiceNow and Idexx Labs are IBD Long-Term Leaders. Nvidia, Amazon, Adobe, Microsoft and ServiceNow are on the IBD 50.  Dow Jones Futures Today  Dow Jones futures rose 0.9% vs. fair value. S&P 500 futures climbed 0.9%. Nasdaq 100 futures rose 0.8%. Remember that overnight action in Dow futures and elsewhere doesn t necessarily translate into actual trading in the next regular stock market session.  Join IBD experts as they analyze actionable stocks in the stock market rally on IBD Live.  Coronavirus News  Coronavirus cases worldwide reached 44.73 million. Covid-19 deaths topped 1.17 million.  Coronavirus cases in the U.S. have hit 9.11 million, with deaths above 233,000.  France will impose a new lockdown effective Friday, with people told to stay at home except to buy essential goods, seek medical care, exercise or go to work if their employer says the job can t be done at home. But schools will remain open. Germany will shut down bars and restaurants starting Monday. Several other European nations have imposed partial coronavirus lockdowns or other restrictions. That will take a toll on travel, consumer spending and the global economy.  So far U.S. cities and states have not sharply raised coronavirus restrictions, but Americans could stay at home more and step up social distancing measures if the pandemic continues to flare up.  Meanwhile, Pfizer (PFE) said Tuesday that it won t have interim coronavirus vaccine data from final-stage trials until after the Nov. 3 election, after previously signaling that it could disclose such data before the end of October.  A coronavirus vaccine won t be available until January, Dr. Anthony Fauci, the nation s top infectious-disease official, predicted Wednesday.  Stock Market Rally  The stock market rally suffered heavy losses, closing essentially at session lows. The Dow Jones Industrial Average fell 3.4% in Wednesday s stock market trading, undercutting its late September low to its worst level since late July. The S&P 500 index lost 3.5%, hitting its worst level since Sept. 25. The Nasdaq composite tumbled 3.7%, through its 50-day line and also to the lowest point since Sept. 25.  Microsoft became the latest software maker to give weak guidance, falling 5% Wednesday. Fellow Dow Jones stock as well as S&P 500 and Nasdaq component Apple sank 4.6%. Amazon dropped 3.8% while Facebook and Google stock dropped 5.5%. Tesla reversed 4.4%. All of these tech giants fell through their 50-day moving averages.  Shopify stock fell 5.5% after making a promising move Tuesday.  With those losses, it s not surprising the Nasdaq crumbled through its 50-day line.  Among the best ETFs, the Innovator IBD 50 ETF (FFTY) sank 3.1%. The iShares Expanded Tech-Software Sector ETF (IGV) retreated 3.5%, with Microsoft and ServiceNow stocks notable members. The VanEck Vectors Semiconductor ETF (SMH) fell 3.2%. Nvidia stock is a key component.  ServiceNow Earnings  ServiceNow earnings rose 22% vs. a year earlier. Revenue climbed 30% to $1.15 billion. Analysts had seen ServiceNow earnings of $1.03 a share on revenue of $1.11 billion.  The business software maker also guided slightly higher on subscription revenue for Q4.  The ServiceNow earnings report and guidance follow warnings or weak guidance from several software makers. German software giant SAP (SAP) issued a major warning on Sunday. Microsoft, Twilio (TWLO) and Dynatrace (DT) gave mixed guidance this week That all followed the warning by Fastly (FSLY), which missed lowered views late Wednesday.  ServiceNow stock rose 2.3% overnight. NOW stock sank 3.15% on Wednesday but found support, for now, at its 50-day line.  Adobe and Salesforce.com (CRM) edged higher after sinking more than 4% on Wednesday.  Pinterest Earnings  Pinterest earnings shot up to 13 cents a share vs. 1 cent a year earlier. Revenue leapt 58% to $443 million. Analysts expected Pinterest earnings of four cents a share on revenue of $383.5 million.  PINS stock shot up 32% in overnight trade. Shares fell 6.2% to 49.25 on Wednesday but were already greatly extended.  Facebook stock climbed 2.7% and Twitter nearly 6% after both lost more than 5% Wednesday ahead of their earnings Thursday night.  Stock Market Analysis  On Monday, IBD changed the market direction classification to ""uptrend under pressure."" Suffice it to say that the stock market rally is under even more pressure now.  With coronavirus concerns soaring and such crucial events as Thursday s earnings tsunami and next Tuesday s Election Day, it s hard to make the case to step up exposure. Apple and Amazon earnings could be great and investors cheer the election results, but that s just a guess. Right now, the stock market rally is reeling.  Dow Jones futures are up, but just a fraction of what the major indexes lost on Wednesday.  Trying to get ahead of the market rally in the past few weeks has meant jumping in just as the tide recedes.  Recent breakouts and early buy points have largely failed. Many leaders have broken down. Investors should be cutting their holdings and awaiting renewed stock market vigor before making new buys. That could come in a few days, weeks or months.  Read The Big Picture every day to stay in sync with the market direction and leading stocks and sectors.  Please follow Ed Carson on Twitter at @IBD_ECarson for stock market updates and more.  YOU MAY ALSO LIKE:  These 4 Stocks Struggle At Buy Points, But This Is The Real Problem  Catch The Next Big Winning Stock With MarketSmith  Want To Get Quick Profits And Avoid Big Losses? Try SwingTrader  Best Growth Stocks To Buy And Watch  IBD Digital: Unlock IBD s Premium Stock Lists, Tools And Analysis Today"
1,2020-10-28,20:49:00,AAPL,https://finance.yahoo.com/news/servicenow-projects-robust-sales-workflow-213034382.html,ServiceNow Projects Robust Sales on Workflow Software Demand,"(Bloomberg) -- ServiceNow Inc. projected subscription sales in the current quarter that narrowly topped Wall Street estimates, signaling that companies are continuing to invest in upgrading their business workflow software while employees remain stuck at home.
Subscription revenue will be $1.15 billion to $1.16 billion in the period ending in December, the Santa Clara, California-based company said Wednesday in a statement. Analysts, on average, estimated $1.13 billion. The company raised its fiscal-year subscription sales forecast to as much as $4.26 billion from about $4.23 billion.
Chief Executive Officer Bill McDermott has pledged to turn 17-year-old ServiceNow into a “software juggernaut.” The company has a plan to reach $10 billion in revenue, on an unspecified time frame, from selling applications that help companies organize their personnel, customer service and IT operations and transition to more online work.
Like rival Salesforce.com Inc., ServiceNow has offered clients a set of software tools to help them safely return to their offices during the coronavirus pandemic. The National Basketball Association and Women’s National Basketball Association used the company’s applications to resume their seasons during the pandemic, McDermott said on a call with analysts. The U.S. Senate, U.S. Air Force and U.S. Department of Veterans Affairs also signed deals with ServiceNow in the third quarter, he said.
“The reality is, others came into the market with good marketing; we came into the market with a great product that was ready to implement in minutes,” McDermott said in an interview. “That’s why we have thousands and thousands of downloads, hundreds of customers and we’re operating at mass scale.” Uber Technologies Inc. selected ServiceNow because it needed a system up and running in two weeks and no other software maker could do that, he added.
Salesforce has said its product, called work.com, is being used by 60 government customers worldwide, including 35 U.S. state agencies and federal agencies including NASA.
In the third quarter, ServiceNow reported subscription revenue increased 31% to $1.09 billion, compared with analysts’ estimate of $1.06 billion. Total sales increased 30% to $1.15 billion in the period ended Sept. 30. Profit, excluding some items, was $1.21 a share. Analysts projected $1.03.
McDermott said companies are using ServiceNow’s software to address a variety of needs, even in the face of business slowdowns during the pandemic, which has forced them to change “on the fly.”
“You’re hiring people, you’re on-boarding people, you need to train people, you need to provide people a self-service employee experience on mobile,” the executive said. “And by the way, you actually need to keep them safe if you do give them the option of coming into the office.”
Shares rose more than 2% in extended trading after closing at $484.05 in New York. The stock has climbed 71% this year.
ServiceNow also appointed Apple Inc. executive Larry Jackson to its board of directors, now enlarged to 11 seats. Jackson, the global creative director of Apple Music, will be ServiceNow’s first Black director. McDermott said in a statement that Jackson would bring a focus on customer experience to the board.
The software maker earlier Wednesday said it named Gabrielle Toledano, previously of Keystone Strategy LLC and Comcast Ventures, as chief talent officer effective in January.
(Updates with comments from CEO starting in the fifth paragraph.)
For more articles like this, please visit us at bloomberg.com
Subscribe now to stay ahead with the most trusted business news source."
2,2020-10-28,20:17:00,AAPL,https://finance.yahoo.com/news/samsung-warns-weaker-outlook-even-001723933.html,Samsung Warns of Weaker Outlook Even as Profit Beats,"(Bloomberg) -- Samsung Electronics Co. warned earnings in the current quarter will decline, saying the strong growth in its mobile and memory business that helped third-quarter profit beat will ease amid intensifying competition and weakening demand.
The world’s largest maker memory chips and personal electronics said net income rose a better-than-expected 52% to 9.27 trillion won ($8.2 billion) in the three months ended September, beating the 7.54 trillion won average of estimates. Samsung foresees capital spending of about 35.2 trillion won this year because of a migration to more advanced chip processes and a buildout of its contract chipmaking business.
The South Korean giant is seeking to regain the lead as the world’s largest smartphone maker after losing the crown earlier this year to Huawei. It introduced new mobile devices during the quarter, benefiting from the gradual reopening of economies worldwide and delays to handset launches by rivals including Apple Inc. The U.S. restrictions on Huawei also prompted rush orders from the Chinese telecoms titan ahead of the Sept. 15 deadline, benefiting Samsung’s memory division.
Looking ahead, Samsung Electronics expects profit to decline in the fourth quarter amid weakening memory chip demand from server customers and intensifying competition in mobile phones and consumer electronics.
“The mobile communications business is likely to see smartphone sales decline and marketing costs increase due to competitive market environment. In consumer electronics, profitability is expected to weaken on growing competition and rising costs, despite solid demand,” Samsung said in the earnings release. “For 2021, the company expects a recovery in overall global demand but uncertainties will remain over the possibility of recurring epidemic waves of COVID-19.”
What Bloomberg Intelligence Says
Samsung Electronics may continue to deliver stronger-than-expected earnings, in our view, on a rebound in smartphone shipments. Huawei’s declining appeal among overseas consumers and a delay in this year’s new Apple iPhone release could aid Samsung’s market share gain, as reflected in its 3Q preliminary profit beat. However, Samsung’s memory chip profit looks set to drop from 3Q’s surprise increase.
--Anthea Lai, analyst
Click here for the research report.
Samsung shares have surged nearly 40% from their March lows. The stock slipped 1.2% on Thursday after the earnings report.
Click here for a live blog on the numbers.
Sales of smartphones jumped nearly 50% during the September quarter as the rollout of its latest Galaxy Note series and a new foldable device reignited demand of premium handsets that had flagged during the coronavirus pandemic. Handset shipments may have climbed to as many as 79 million units during the period, Samsung Securities estimated before the earnings announcement.
Overall demand for memory exceeded expectations in the third quarter, boosted by Huawei and other mobile customers. While mobile demand may continue to remain strong in the fourth quarter and into the first half, server orders are likely to be weak with the prolonged pandemic prompting clients to slow orders, Samsung said.
Server memory prices are already correcting. Contract prices for 32-gigabyte DRAM server modules fell 9% in the September quarter, according to InSpectrum Tech Inc. Prices for 128-gigabit MLC NAND flash memory chips decreased about 8% in the third quarter. Rival Micron Technology Inc. cut capital spending plans last month, warning about weaker demand from some corporate customers and forecast possible oversupply of flash memory chips next year.
The death of Samsung Group Chairman Lee Kun-hee over the weekend may add to further uncertainty. While his son Jay Y. Lee is expected to take over as chairman of the group, the younger Lee still faces two trials over allegations he used bribery and accounting trickery to smooth his path to succession. The family will also have to pay billions of dollars in inheritance tax, and Samsung has so far declined to comment on how they will fund the payments.
Read more: Lee’s Risk of Jail Time Complicates Samsung Succession Plans
For more articles like this, please visit us at bloomberg.com
Subscribe now to stay ahead with the most trusted business news source."
3,2020-10-28,20:08:00,AAPL,https://finance.yahoo.com/news/pinterest-reports-strong-revenue-ad-200752762.html,Pinterest Reports Strong Revenue as Ad Demand Rebounds,"(Bloomberg) -- Pinterest Inc. reported quarterly sales that topped analysts’ estimates after advertiser demand bounced back from budget cuts seen during the initial outbreak of Covid-19. The shares surged.
Third-quarter revenue jumped 58% to $443 million, the digital search and scrapbooking company said Wednesday in a statement. Analysts, on average, projected $387.8 million, according to data compiled by Bloomberg. The company also predicted that sales would increase about 60% in the holiday quarter, which would be higher than analysts’ projections of 38% growth.
Pinterest said it had 442 million monthly users at the end of the period, a gain of 37% from a year earlier and higher than the average estimate of about 431 million. The shares jumped more than 30% in extended trading.
Read more: Pinterest Founders Double Their Wealth With Latest Stock Surge
The San Francisco-based company said in July that revenue growth increased about 50% in the month, though it expected the numbers to decline throughout the quarter. But advertiser demand stayed high during the three-month period ending in September as advertisers adapted to the new reality brought on by the coronavirus. Pinterest specifically cited an uptick in small business advertisers, retailers and large advertisers of consumer packaged goods.
Chief Executive Officer Ben Silbermann attributed some of Pinterest’s user growth to the changing environment as more people move communication and activities online. “More than ever before, people are coming to Pinterest to get inspiration for their lives,” Silbermann said in the statement.
Pinterest also said it received a boost of almost 4 million monthly active users when young people upgraded their iPhones to Apple Inc.’s new operating system, iOS 14, and used Pinterest to come up with ideas for new background filters.
Pinterest’s third-quarter revenue growth is another sign the digital ad industry has returned to pre-Covid levels -- an idea that was reinforced last week when Snap Inc. also reported better-than-expected sales. Facebook Inc., Alphabet Inc. and Twitter Inc. report earnings on Thursday.
(Updates share gain in third paragraph.)
For more articles like this, please visit us at bloomberg.com
Subscribe now to stay ahead with the most trusted business news source."
4,2020-10-28,18:07:00,AAPL,https://finance.yahoo.com/news/daily-crunch-apple-seems-pretty-220710276.html,Daily Crunch: Apple seems pretty interested in search,"Apple  might be building a Google competitor, Audible adds more podcasts and an ad measurement company raises $350 million. This is your Daily Crunch for October 28, 2020.
The big story: Apple seems pretty interested in search
Apple has a growing interest in search technology and might even be working on a product to compete with Google, according to The Financial Times.
The most visible change is the fact that in iOS 14, Apple is now showing its own results when you type queries in the home screen. In addition, there seems to be an increase in activity from Apple s web crawler.
There may be more of an opportunity here as the U.S. Justice Department has sued Google over what it claims are anticompetitive behaviors around search. However, this doesn t necessarily mean Apple and Google will soon be going head-to-head in search — it could just be a sign that Apple s Siri voice assistant is getting more search queries.
The tech giants
Joe Rogan, Alex Jones and Spotify’s illusion of neutrality — Spotify is facing criticism after Joe Rogan brought Alex Jones of InfoWars onto his show.
Audible further expands into podcasts — Audible is adding approximately 100,000 podcasts.
Apple eyes the TikTok generation with an updated version of Clips — The update brings much-needed support for vertical videos, allowing for sharing to TikTok and the “Stories” feature in other social apps.
Startups, funding and venture capital
DoubleVerify, a specialist in brand safety, ad fraud and ad quality, raises $350M — DoubleVerify s technology can detect fraud, viewability and brand safety.
Outrider raises $65M to bring its autonomous tech to distribution yards — The startup has built a three-part system that includes an autonomous electric yard truck, software to manage the operations and site infrastructure.
Lunchbox raises $20M to help restaurants build their own ordering experiences — CEO Nabeel Alamgir said that if restaurants can handle more online orders themselves (rather than just relying on delivery apps), they’ll make more money while also maintaining a direct relationship with their most loyal customers.
Advice and analysis from Extra Crunch
As venture capital rebounds, what’s going on with venture debt? — While venture capital is back setting new records, it appears that its lesser-known sibling won t be able to match the past few years  results.
Current and upcoming trends in Latin America’s mobile growth — Latin America is home to one of the fastest-growing mobile markets in the world.
Dear Sophie: Any upgrade options for E-2 visa holders interested in changing jobs? — Another edition of Sophie Alcorn s column answering immigration questions about working at technology companies.
(Reminder: Extra Crunch is our membership program, which aims to democratize information about startups. You can sign up here.)
Everything else
Qualtrics CEO Ryan Smith is buying majority stake in the Utah Jazz for $1.6B — Smith sold Qualtrics to SAP for $8 billion in 2018.
US online holiday sales to reach $189B this year, up 33% from 2019 — That s according to a new forecast from Adobe Analytics."
