,date,time,ticker,link,headline,content
36,2020-10-28,03:00:00,AAPL,https://finance.yahoo.com/news/u-europe-still-don-t-070014499.html,The U.S. and Europe Still Dont See Eye to Eye on Big Tech,"(Bloomberg Opinion) -- It’s tempting to imagine that the U.S. is finally catching up with Europe when it comes to skepticism — and regulation — of Big Tech.
The reality is different. While the Department of Justice is now pursuing a lawsuit against Google parent Alphabet Inc., and a House panel has proposed reforms to curb the power of Silicon Valley’s biggest firms, the European Union’s tackling of Big Tech is at a very different stage in its evolution. But ploughing too far ahead of the U.S. may be risky.
It’s useful to consider tech antitrust regulation in two acts. In the first, authorities seek to use tools already at their disposal to correct companies’ worst excesses. Should this prove ineffective, lawmakers can then move to the second act and seek to strengthen these tools by updating antitrust laws.
In the EU, the first act has played out over the past decade, as the region’s antitrust police have leaned on existing tools to impose so-called behavioral remedies, which aim to stop discrete anti-competitive practices: fines totaling 8.2 billion euros ($9.7 billion) on Google for monopolistic misbehavior in e-commerce, search and mobile operating systems; and an injunction seeking back taxes from Apple Inc. Further probes into Apple, Amazon.com Inc. and Facebook Inc. are well underway.
Despite those efforts, Big Tech’s dominance of online advertising and e-commerce continues seemingly unabated. It is perhaps too early to say that behavioral remedies have failed to keep the firms in check. But the European Commission, the bloc’s civil service, is pulling together a set of proposals which, if approved by the European Parliament, would give it expanded regulatory powers to tackle so-called “gate-keeping” platforms and may include the ability to force company breakups. They could arrive by the end of the year and be considered by parliament in 2021. In short, Europe is nearing the end of the first act and is about to embark upon the second.
QuicktakeThe New Tools the EU Wants to Crack Down on Big Tech
The U.S. has meanwhile only just lifted the curtain on Act I. The Justice Department’s case against Google and the Federal Trade Commission’s impending decision on whether to bring a lawsuit against Facebook have, admittedly, the potential to be more blockbuster than anything the EU has managed to achieve. The DOJ has already intimated that it is open to considering so-called structural remedies, which can be further-reaching than behavioral ones. An extreme example would be precipitating Google to separate or divest part of its business.
Even so, the Google and Facebook cases (should the latter materialize) are both likely to take years. And proposals from the House subcommittee to update antitrust laws seem a long way from graduating to a bill, let alone an act. While the DOJ case may have bipartisan support, changing antitrust laws does not, unlike in Europe. If the cases prove successful in reining in the tech giants, it’d be easy to argue that the current tools are adequate, and therefore new laws aren’t required. Indeed, the cases might be an effort to preempt the need for new legislation, according to Nicolas Petit, a professor of competition law at the European University Institute and the author of “Big Tech and the Digital Economy: The Moligopoly Scenario.”
As the EU proceeds irrespectively with plans for a new antitrust toolbox, antitrust chief Margrethe Vestager and her cohort will have to make difficult choices about whether and how to use those new powers. Don’t get me wrong: Strengthening European regulators may well be desirable and prompt the tech giants to think more carefully about their actions.
Although it may appear that Europe and the U.S. are now singing from the same hymn sheet, there is a subtle discord. Any perceived European overreach could set the two regions on a collision course.
This column does not necessarily reflect the opinion of the editorial board or Bloomberg LP and its owners.
Alex Webb is a Bloomberg Opinion columnist covering Europe s technology, media and communications industries. He previously covered Apple and other technology companies for Bloomberg News in San Francisco.
For more articles like this, please visit us at bloomberg.com/opinion
Subscribe now to stay ahead with the most trusted business news source."
37,2020-10-27,21:53:00,AAPL,https://finance.yahoo.com/news/apple-stock-buy-ahead-earnings-015307496.html,Is Apple Stock a Buy Ahead of Earnings? This Is What You Need to Know,"Apple (AAPL) will report FQ4 earnings on Thursday evening in what will as per usual be one of earnings season’s highlights. This September quarter’s results, however, will have a different flavor, due to the well-publicized delay to the new iPhone’s release. An issue Deutsche Bank analyst Jeriel Ong believes will be on investors’ minds when Apple releases its quarterly financial results.
“We expect a solid Sept-qtr report from AAPL, but see investors overlooking any recent strength/weakness and focusing on the Dec-qtr given the recent iPhone release and impact on guidance and the Mar-qtr beyond, as this is the first time that all new iPhone products are a month or more delayed. With only a week of new iPhone sales by the time earnings are reported on 10/29, we are unsure that AAPL will feel comfortable with guidance,” Ong wrote.
In fact, Apple has not provided any official guidance since January, while for the December quarter, the tech giant usually has 1.5 months of sales data to base the guidance on, it is a luxury the company does not have this time around.
As for the September quarter’s results, Ong expects revenue of $62.7 billion, indicating a 5% quarter-over-quarter uptick yet down by 2% year-over-year. The Street’s forecast calls for $63.8 billion. Ong’s EPS estimate stands at $0.69 compared to the Street’s $0.70 estimate.
In contrast to Apple, Ong does provide guidance for the next quarter and expects revenue to increase by 9% year-over-year and 60% quarter-over-quarter to $100.1 billion, slightly below the Street’s call for $100.6 billion. On the bottom line, Ong expects EPS of $1.37, the same as the Street’s estimate.
As a side note, the 5-year average quarter-over-quarter increase for revenue in the Dec Quarter stands at 52%. “Given the lack of 1 week of new iPhone revenues in the Sept-qtr due to the delayed release, we would expect AAPL to beat seasonality comfortably in the Dec-qtr,” Ong added.
All in all, ahead of the print, Ong reiterates a Buy rating on AAPL shares along with a $140 price target. This figure suggests a 20% upside potential from current levels. (To watch Ong’s track record, click here)
Apple has decent support on the Street with 26 Buys, 8 Holds and 1 Sell coalescing to a Moderate Buy consensus rating. At $125.81, the average price target suggests room for an 8% uptick. (See Apple stock analysis on TipRanks)
To find good ideas for tech stocks trading at attractive valuations, visit TipRanks’ Best Stocks to Buy, a newly launched tool that unites all of TipRanks’ equity insights."
38,2020-10-27,21:03:00,AAPL,https://finance.yahoo.com/news/amd-35-billion-deal-pushes-010355468.html,AMDs $35 Billion Deal Pushes 2020 Toward a Record for Chip M&A,"(Bloomberg) -- Advanced Micro Devices Inc.’s $35 billion purchase of semiconductor maker Xilinx Inc. pushes 2020 toward a record year for chip deals, as large tech companies rush to consolidate the increasingly competitive industry.
There have now been $110 billion of deals announced in the semiconductor industry this year, led by Nvidia Corp.’s $40 billion bid for Cambridge, England-based chip designer Arm, according to data compiled by Bloomberg. The Xilinx deal makes 2020 the biggest year at this point on record for pending and completed deals involving semiconductors, the data show.
The highwater mark for semiconductor deals was reached in 2016, when $122 billion in transactions were struck for the entire year. If acquisitions continue at the current pace, 2020 will easily top that level. The largest deal of 2016 was SoftBank Group Corp.’s $24 billion purchase of Arm.
Competition in the semiconductor industry is heating up as companies that were once customers, such as Apple Inc., design their own chips and established players like Nvidia branch out into new areas.
One adviser estimates that there are about 75 public chip companies now and that number could be cut in half because of consolidation in the next few years.
Read more: AMD’s Su Redoubles Intel Challenge With Xilinx Deal
With the Arm deal, Nvidia gets access to semiconductor designs that are in most smartphones and licenses for chips that run thousands of appliances known as the Internet of Things.
Buying San Francisco-based Xilinx gives AMD access to programmable chips for wireless telecommunication networks ahead of phone carriers’ plans to build out high-speed fifth-generation mobile networks. It also helps the company expand further in the profitable market for data-center computer components, currently dominated by Intel Corp.
Earlier this month, Intel agreed to sell its Nand memory unit to South Korea’s SK Hynix Inc. for about $9 billion.
These rivalries have made the industry stand out in an otherwise sluggish deal market. Globally, mergers and acquisitions in all sectors are down roughly 23% to about $1.9 trillion from the same period last year, Bloomberg data show.
For more articles like this, please visit us at bloomberg.com
Subscribe now to stay ahead with the most trusted business news source."
39,2020-10-27,20:26:00,AAPL,https://www.marketwatch.com/story/apple-inc-stock-outperforms-market-on-strong-trading-day-01603844807?siteid=yhoof2,Apple Inc. stock outperforms market on strong trading day,"Shares of Apple Inc. AAPL, -4.63% slipped 4.63% to $111.20 Wednesday, on what proved to be an all-around grim trading session for the stock market, with the NASDAQ Composite Index COMP, -3.73% falling 3.73% to 11,004.87 and Dow Jones Industrial Average DJIA, -3.43% falling 3.43% to 26,519.95. The stock s fall snapped a two-day winning streak. Apple Inc. closed $26.78 below its 52-week high ($137.98), which the company reached on September 2nd.  The stock demonstrated a mixed performance when compared to some of its competitors Wednesday, as Microsoft Corp. MSFT, -4.95% fell 4.96% to $202.68, Alphabet Inc. Cl A GOOGL, -5.50% fell 5.51% to $1,510.80, and International Business Machines Corp. IBM, -3.53% fell 3.54% to $106.65. Trading volume (142.1 M) remained 21.9 million below its 50-day average volume of 164.0 M.  Editor s Note: This story was auto-generated by Automated Insights using data from Dow Jones and FactSet. See our market data terms of use."
40,2020-10-27,19:22:00,AAPL,https://www.marketwatch.com/story/jon-stewart-returning-to-tv-with-new-series-for-apple-report-11603840926?siteid=yhoof2,Jon Stewart returning to TV with new series for Apple: report,"Former ""Daily Show"" host Jon Stewart testifies during on Capitol Hill in June 2019. Getty Images  Jon Stewart, former host of “The Daily Show,” is reportedly making a return to TV, hosting an hourlong current-affairs series on Apple TV+.  The Hollywood Reporter broke the news Tuesday, saying the show is part of an extensive, multiyear deal with Apple Inc.’s AAPL, -4.63% streaming service. Stewart will reportedly serve as executive producer for the as-yet-unnamed series, and the deal includes the possibility for making more shows from Stewart’s production company."
41,2020-10-27,18:10:00,AAPL,https://www.engadget.com/jon-stewart-apple-tv-plus-221022043.html,Jon Stewart's next TV show is coming to Apple TV+,"Whatever the outcome of the November 3rd presidential election, Jon Stewart will be there to give his take on the politics of the day thanks to a new deal the comedian has signed with Apple. The Hollywood Reporter reports Stewart will host a new series for Apple TV+ that will see him touch on current affairs with dedicated hour-long episodes that focus on a single topic.  The new series doesn’t have a title yet, nor has Apple shared an exact release date — but it will reportedly premiere sometime next year. Moreover, in a departure from The Daily Show, new episodes won’t come out on a nightly or weekly schedule. Another unknown is how much content Stewart will produce for Apple. The company said it has a multi-year deal with the comedian, but didn’t mention how many episodes each season of the series will include."
42,2020-10-27,17:45:00,AAPL,https://finance.yahoo.com/news/microsoft-msft-posts-strong-q1-214509070.html,Microsoft (MSFT) Posts Strong Q1 Earnings Beat,"We started out the trading day in decent shape, but Covid-19 realities appear to be re-establishing themselves in stock market activity. While the Dow, S&P 500 and Russell 2000 dropped by 0.3-0.9% today, the tech-heavy Nasdaq eked out a +0.64% trading day. The Dow is now on a three-day losing streak, having given back all of its October gains and is now 7% off its all-time highs.The Nasdaq, on the other hand, is up in three of the past four sessions, on the strength of those old “shelter in place” plays: Zoom Video ZM, Facebook FB and Netflix NFLX all performed well on the day. It, along with the S&P 500, remain 5% off their highs established in August. Industrials and Financials were both down roughly 2% on the day.Nasdaq component and Zacks Rank #2 (Buy)-rated Microsoft MSFT has posted a strong earnings beat in its fiscal Q1 report released after Tuesday’s closing bell: $1.83 per share was well out in from of the $1.53 in the Zacks consensus, and even further out in front of the $1.38 per share reported in the year-ago quarter. Revenues of $37.2 billion outperformed the $35.7 billion expected, partly on the company’s Intelligent Cloud better-than-expected $13 billion reported for the quarter.Microsoft’s shares are up marginally on the news, and +35% year to date. The company has not posted an earnings miss since fiscal Q2 2016, with a trailing four-quarter average earnings beat of 10%. Details will be forthcoming in the conference call, including guidance. The Zacks consensus for fiscal Q2 is $1.59 per share, $6.36 per share for the full year.The company is the latest of the major tech firms to report quarterly earnings. Last week, Netflix put up disappointing numbers on lower-than-expected net subscriber adds. The remainder of this week brings us results from Apple AAPL, Amazon AMZN, Alphabet GOOGL and Facebook FB, among many others.Questions or comments about this article and/or its author? Click here>> 
It could become the mother of all technological revolutions. Apple sold a mere 1 billion iPhones in 10 years but a new breakthrough is expected to generate more than 27 billion devices in just 3 years, creating a $1.7 trillion market.
Zacks has just released a Special Report that spotlights this fast-emerging phenomenon and 6 tickers for taking advantage of it. If you don t buy now, you may kick yourself in 2021.
Click here for the 6 trades >>"
43,2020-10-27,17:09:00,AAPL,https://www.investopedia.com/investors-stay-in-the-neutral-zone-as-election-uncertainty-clouds-the-runway-5084549?utm_campaign=quote-yahoo&utm_source=yahoo&utm_medium=referral,Investors Remain in the Neutral Zone as Anxiety Stays High,"More than seven months into the pandemic, and with a week to go before the election, investors find themselves in quite a paradox. On the one hand, there is the fear of missing out on more returns in the equity market. On the other, is elevated anxiety about the outcome and aftermath of the election and what that will do to their portfolios. Those are among the key takeaways from our recent survey of Investopedia readers, the fifth we have conducted since before the coronavirus was named a global pandemic.  Caught in the Neutral Zone  While our readers are slightly less bullish than they were in August, they are also slightly less bearish than they were in the summer. Since then, economies have opened up and growth is strong across most industries – although the labor market remains compromised – yet the virus is still very present in everyday life. Equity markets have trudged higher after rebounding out of the fastest bear market in history, and that has caused some concerns about stretched valuations in some stocks and sectors.  The Election is the Overhang  The upcoming election remains the dominant concern among our readers. While they are split on who they think will win the election, they remain concerned about the impact it will have on their portfolios. They are also concerned about what will happen in the aftermath of the election and whether it will be contested and peaceful.  Staying the Course  Despite their worries, only one quarter of our survey respondents, who range in age and income across the U.S., are making changes to their portfolios. Most are sticking with the stocks and strategies that have carried them through this tumultuous year. Their favorite stocks (listed below) show that they have chosen wisely and safely.  Millennials are significantly more likely than boomers to say they re making big changes to their investments based on recent market events (25% vs 15). Among those making changes, Millennials are more likely to be investing more (45% of Millennials responding to the market say they re investing more money vs 18% of Boomers). They re also going riskier. 31% of Millennials making changes say they re moving into riskier investments vs 13% of Boomers).  Too Far, Too Fast?  62% of our survey respondents, regardless of age, think the stock market has become overvalued. 71% believe that the economy and the stock market are disconnected and 54% anticipate it could experience another significant drop in the next three months. The reasons for that are as described: The election, its aftermath, and the possibility of another economic shutdown.  They are also slightly concerned about President Trump’s use of social media as a communications tool and its impact on the stock market, as well as his health and the health of his administration. We fielded the survey just as the president tested positive for COVID-19 and was subsequently hospitalized.  Investors Keep the Faith in Their Favorite Stocks  Our readers have proven to be faithful investors when it comes to their portfolios. The top 10 holdings have remained fairly consistent throughout the pandemic, although there is variation among the different age groups of our readers. But the top three holdings – Apple (AAPL), Microsoft (MSFT), and Amazon (AMZN) – are also among the most widely held stocks in index funds, ETFs, hedge funds, endowments, and among retail investors.  Millennials are even more likely to favor IT (49% vs 41% among Boomers) and Boomers are even more likely to favor healthcare (19% vs 12% millennials).  Older investors have held onto their favorite dividend paying stocks like Bank of America (BAC) and Verizon (VZ), as well as traditional media companies like Disney (DIS). Tesla (TSLA) investors are nothing if not loyal and they have stuck with the electric car maker through many peaks and valleys, although 2020 has mostly been peaks.  What’s Next?  The next few months are a big question mark for investors. The election is the obvious elephant in the room, but beyond that, the resurgence of the virus and another potential lockdown, concerns about social unrest, and the widening disconnect between the capital markets and the economy will cloud the horizon. Individual investors, like our readers, have different time horizons and goals for investing than institutional investors. They can mostly afford to be patient until the smoke clears on any one or all of those issues. Until then, expect them to stay in the neutral zone."
44,2020-10-27,17:02:00,AAPL,https://finance.yahoo.com/news/comedian-jon-stewart-return-tv-210257444.html,Comedian Jon Stewart to return to TV on Apple's streaming service,"By Lisa Richwine
LOS ANGELES, Oct 27 (Reuters) - Former ""Daily Show"" host Jon Stewart will host and produce a new current affairs series for Apple Inc s streaming television service, the company announced on Tuesday.
The multi-season series on Apple TV+ will bring the comedian back to TV on a regular basis for the first time since he ended his Emmy-winning run as host of ""The Daily Show"" in 2015.
No debut date for the untitled series was announced. Apple said in a statement that each one-hour episode would address a single issue and explore topics related to current events and Stewart s advocacy work.
The issues also will be discussed in a companion podcast, the company said.
Stewart’s irreverent brand of political and media satire made him a beloved figure on television with influence far beyond the 2 to 3 million nightly audience of ""The Daily Show"" on Comedy Central.
Since leaving the ""Daily Show,"" Stewart has appeared occasionally on talk shows and this year released a political comedy film called ""Irresistible"" that he wrote and directed.
He also has advocated for wounded veterans and for healthcare benefits for first responders who became ill after the Sept. 11, 2001, attacks. He and his wife, Tracey, opened a farm sanctuary in New Jersey.
Stewart s new series is part of a multi-year agreement with Apple to develop and produce projects for Apple TV+, a $5-a-month competitor to subscription video services from companies such as Netflix Inc and Walt Disney Co ."
45,2020-10-27,16:38:00,AAPL,https://www.marketwatch.com/story/apple-has-acquired-a-video-focused-ai-company-report-2020-10-27?siteid=yhoof2,Apple has acquired a video-focused AI company: report,"Apple Inc. AAPL, -4.63% has reportedly acquired Vilynx, an artificial-intelligence company based in Spain, according to Bloomberg. The report, which cites multiple unnamed sources, said that Apple scooped up Vilynx earlier this year and may use the company s AI and computer-vision technologies to analyze video content and improve the way Apple employs artificial intelligence in its apps. Apple told Bloomberg in a statement that it ""buys smaller technology companies from time to time and we generally do not discuss our purpose or plans,"" according to the report. Bloomberg cited the deal price at about $50 million, citing its sources. Apple shares ended Tuesday s session up 1.4%. The stock has risen 23% over the past three months as the Dow Jones Industrial Average DJIA, -3.43% has gained 3.3%."
