,date,time,ticker,link,headline,content
48,2020-10-27,15:22:00,AAPL,https://finance.yahoo.com/news/apple-buys-self-learning-ai-192246478.html,Apple Buys Self-Learning AI Video Company to Improve Apps,"(Bloomberg) -- Apple Inc. acquired a startup specializing in advanced artificial intelligence and computer vision technology that may help the iPhone maker improve its own AI across a number of apps and services.
The Cupertino, California-based technology giant acquired Barcelona-based Vilynx Inc. earlier this year, according to people familiar with the deal. Vilynx developed technology that uses AI to analyze a video’s visual, audio and text content to understand what the video shows. It used that technology to create tags for the video, making it searchable.
The deal was completed for about $50 million, said the people who asked not to be named because they weren’t authorized to speak about the transaction.
“Apple buys smaller technology companies from time to time and we generally do not discuss our purpose or plans,” the company said in a statement.
Vilynx applied its technology to software that companies used for search and recommendation engines for video and other media. On its now defunct website, the startup touted the ability of its system to not only recognize items, but understand them.
“Recognition is detecting Michael Jordan’s face,” the website said. “Understanding is knowing it’s Michael Jordan, the former NBA basketball player who played for the Chicago Bulls and went to the University of North Carolina.”
Apple could potentially apply this technology to the company’s digital assistant, Siri, and its search. It could also be used in the company’s Photos app to make video more searchable in a similar fashion to how users can find photos by searching for items inside the photos. Apple could also potentially apply it toward a recommendation engine for its TV and News apps to surface more relevant content to users.
About 50 of the company’s engineers and data scientists are remaining at Apple, including Vilynx’s co-founder and Chief Technology Officer Elisenda Bou-Balust, the people familiar said.
Apple is keeping Vilynx’s Barcelona office and intends to make it one of the company’s main artificial intelligence research and development centers in Europe, the people said. Apple has started hiring engineers for the office. Apple also has AI engineers in Europe in Cambridge, U.K.; Cork, Ireland; Munich and Zurich.
The deal adds to a growing list of AI companies purchased by Apple in recent years. In 2020, Apple also acquired Xnor.ai, Inductiv and Voysis to bolster its artificial intelligence efforts.
Apple launched Siri in 2011 and has since expanded AI across its software, including the Camera and Photos apps, battery life optimization, and facial and handwriting recognition. But while the company has made strides to improve the machine learning technology, the Siri voice assistant is still regarded as inferior to rivals from Alphabet Inc.’s Google and Amazon.com Inc.
Apple’s recent AI-related deals, an increased public presence for the machine learning group, the hiring of new researchers and the appointment of former Google executive John Giannandrea signal the company’s effort to make major improvements.
For more articles like this, please visit us at bloomberg.com
Subscribe now to stay ahead with the most trusted business news source."
49,2020-10-27,14:15:00,AAPL,https://finance.yahoo.com/news/heres-why-t-mobile-is-getting-into-the-tv-business-181538165.html,Here's why T-Mobile is getting into the TV business,"The integration of Sprint and the Apple 5G iPhone rollout be damned — T-Mobile (TMUS) CEO Mike Sievert says his team could continue to maniacally focus on that meshing of cultures and operations and the Apple (AAPL) launch while launching a new attack on Big Cable.
""We are serious,"" Sievert told Yahoo Finance about his fresh effort to challenge pay TV providers. To be sure, the mobile phone operator (at least until now) made a big splash Tuesday by entering the surging streaming content space.
On Nov. 1, T-Mobile will launch nationwide what it calls TVision LIVE. It will feature three different pay and content tiers. The entry level one is called TVision Live TV. It will cost $40 a month for 30-plus channels including ABC, Fox, NBC, Turner and ESPN. Go up to the top tier called TVision Live Zone, you get more than 50 channels (NFL Network, SEC Network, etc.) and NFL Red Zone for $60.
Rounding out the attack plan is the TVision VIBE service (offers live and on-demand programming for $10 a month) and TVision CHANNELS service (a-la-carte streaming offering).
The pricing is well below typical cable TV plans from the likes of Comcast (CMCSA) and AT&T (T) that could fetch north of $150 a month. Those sky high cable bills — and the fact people don t watch a majority of the channels they pay for — is what continues to fuel cord-cutting across the U.S.
Well that and because original programming out of Amazon (AMZN) and Netflix (NFLX) is so darn compelling and a monthly subscription is still dirt cheap.
To lure in customers, T-Mobile has joined forces with Apple to offer one free year of Apple TV+. That s provided a person signs up for the premium TVision bundles. Sievert says T-Mobile has no intention of creating its own content a la Netflix or Amazon.
The T-Mobile-Apple partnership is not unlike the one Yahoo Finance s parent Verizon (VZ) and Disney (DIS) have worked on. Verizon has continued to offer Disney+, Hulu and ESPN+ to mobile phone subscribers this year who trade up to larger data plans. Last October, Verizon struck first on streaming by offering one free year of Disney+ to 4G LTE and 5G unlimited wireless customers and FiOS internet households.
Brian Sozzi is an editor-at-large and co-anchor of The First Trade at Yahoo Finance. Follow Sozzi on Twitter @BrianSozzi and on LinkedIn.
What’s hot from Sozzi:
Walmart CEO: the lack of stimulus is taking its toll
Senator Ted Cruz: big tech is drunk on power
Shark Tank star Kevin O’Leary: people need to save more money
IBM CEO: here’s why we just made a landmark business move
Home Depot co-founder and Atlanta Falcons owner gives his best advice to new NY Mets owner
Peloton founder: here’s one of my biggest 15 year goals
Kraft Heinz CEO: Buffett’s team like our $3.2 billion deal
Kroger CEO: this is how we see the future of food shopping"
50,2020-10-27,13:28:00,AAPL,https://finance.yahoo.com/news/gary-cohn-would-back-bidens-proposed-28-corporate-tax-rate-172828437.html,Ex-Trump adviser Gary Cohn would back Bidens proposed 28% corporate tax rate,"President Donald Trump’s former chief economic adviser, Gary Cohn, once helped craft the Tax Cuts and Jobs Act of 2017 that lowered the corporate federal income tax rate (TCJA) from 35% to 21%. Yet he’s comfortable with the rate moving no higher than 28%, a level proposed by Democratic presidential candidate Joe Biden, Cohn told Yahoo Finance’s Adam Shapiro in an interview during Yahoo Finance’s All Markets Summit on Monday.
The 28% corporate tax rate proposed by Biden would still make the U.S. an attractive place for businesses, according to Cohn, a Democrat who served for a decade as COO for The Goldman Sachs Group, Inc. before his time in the White House.
“How do you compete against every other nation in the world? Because international corporations can decide where they’re domiciled ... To me, 28% is probably a good number to land on, to end up being attractive to corporations to be in the United States,” Cohn said.
And it’s not just the tax rate, Cohn added, it s what is being taxed. Under the CARES Act, he said, in order to stimulate the economy, corporate deductions eliminated under Trump’s tax law, such as travel and entertainment, were brought back.
The Trump administration’s tax overhaul has come under criticism given persistent loopholes that allow corporations to drive the effective rate well below the statutory level. In 2018, the work arounds helped a group of 378 consistently profitable Fortune 500 companies to pay an average federal rate of 11.3% on their 2018 income, according to a report from the Institute on Taxation and Economic Policy (ITEP), a non-partisan think tank.
But Cohn said the overhaul still got rid of many loopholes.
“Let s compare it to what it was prior,” Cohn said of Trump’s tax law. “There were many corporations paying no tax under the prior tax law, as well. We eliminated a lot of the loopholes. I m not going to sit here and say we eliminate all the loopholes. We eliminated many, many of the loopholes.”
The ITEP’s most recent report on corporate tax loopholes may tell a different story. It analyzed the rates paid by profitable Fortune 500 companies during one year under the new rate and eight years under the prior rate. Both resulted in effective rates paid of just more than half the statutory rates.
From 2008 to 2015 when the tax rate was 35%, 258 consistently profitable Fortune 500 corporations paid an effective corporate tax rate of 21.2%, with many prominent companies like General Electric (GE), Priceline.com, and PG&E (PCG) paying no tax at all, according to the ITEP analysis.
In 2018, among 379 profitable corporations in the study the effective federal rate paid was 11.3%, with 91 corporations including Amazon (AMZN), Chevron (CVX), Halliburton (HAL) and IBM (IBM) paying zero federal income tax.
ITEP concluded that loopholes and special breaks rather than the rate itself were responsible for the shortfalls.
“We still have a huge offshoring issue,” Cohn said of loopholes still needing to be closed. “You can create these intellectual property boxes offshore and put your intellectual property in them and then license them back to your U.S. subsidiary. We were doing a lot of work on that. We went as far as we thought we could go and get a tax bill passed.”
Practices known as the “Double Irish” and “Dutch Sandwich” were popularized by Apple (AAPL) and adopted by companies with large intangible assets, predominantly intellectual property, to avoid paying income tax. Google (GOOG)(GOOGL), Microsoft (MSFT), and others have used the strategy to push profits to tax havens in Bermuda, for example, through wholly owned subsidiaries in Ireland and The Netherlands. In 2019, Google announced it would no longer implement the tax strategy and going forward would license its IP in the U.S. instead of in Bermuda.
Asked whether a 28% rate was counter to the federal government’s goal of clawing back tax dollars to federal coffers, Cohn said the figure represents one that is the upper limit of what corporations will view as competitive.
“There s a rate where it gets too high, where they don t want to be,” Cohn said. “That 21% to me was the lower end of where we needed to be.”
Read more:
Former Trump advisor Gary Cohn: Markets are down on the  100% probability  that stimulus deal won t pass before the election
Gary Cohn wants $1 trillion to save the U.S. economy
Alexis Keenan is a legal reporter for Yahoo Finance and former litigation attorney.
Follow Alexis Keenan on Twitter @alexiskweed."
51,2020-10-27,12:45:00,AAPL,https://www.fool.com/investing/2020/10/27/better-buy-lumentum-vs-texas-instruments/?source=eptyholnk0000202&utm_source=yahoo-host&utm_medium=feed&utm_campaign=article,Better Buy: Lumentum vs. Texas Instruments,"Lumentum  and Texas Instruments  are both major supply chain players in the tech sector. Lumentum produces optical chips and lasers, and TI sells chips to automotive, industrial, consumer electronics, and communication infrastructure companies.  Both companies have suffered disruptions during the COVID-19 crisis, but their stocks stayed resilient: Over the past 12 months, Lumentum s stock has risen nearly 50% as TI s stock advanced more than 20%. Let s see why Lumentum stayed ahead of TI, and whether or not that trend will continue.  How fast is Lumentum growing?  Lumentum generated 90% of its revenue from its optical communications unit -- which sells optical chips to service providers and data center customers, as well as 3D-sensing chips for advanced cameras -- in fiscal 2020, which ended on June 27. The remaining 10% came from its laser unit, which sells lasers for manufacturing, inspection, and life science purposes.  The optical communication unit s top customer is Apple , which installs Lumentum s optical chips in the iPhone s 3D-sensing cameras. Orders from Apple accounted for 26% of Lumentum s total revenue last year, and that percentage could rise this year with the addition of a LiDAR sensor in the iPhone 12 Pro.  But another major customer is Huawei, which still accounted for 13% of Lumentum s sales last year despite being blacklisted by U.S. regulators. It expects its sales to Huawei to continue declining in fiscal 2021.  Lumentum s total revenue grew 7% to $1.68 billion last year, marking its slowest growth in four years, as a 16% decline in its laser revenue partly offset its 11% growth in optical communications revenue.  The pandemic hurt the laser business, which had already been struggling with weaker demand for fiber lasers, more than the optical business, which offset its slower enterprise optical chip sales with higher 3D-sensing chip sales.  Despite those challenges, Lumentum s adjusted gross and operating margins still expanded in fiscal 2020, thanks to a better product mix and tighter cost controls, and its adjusted earnings grew 28%. Lumentum hasn t offered a full-year forecast for fiscal 2021, but analysts expect its revenue and earnings to rise 5% and 4%, respectively, before accelerating to double-digit levels in 2022.  How fast is Texas Instruments growing?  Texas Instruments generated 75% of its revenue from analog chips, which include power and signal chain chips, in the first nine months of 2020. Its embedded processing chips, which include connected microcontrollers and processors, generated another 18%.  The remaining 7% came from other types of chips. None of TI s customers accounted for over 10% of its revenue last year.  TI generated 57% of its revenue from the industrial and automotive markets last year, up from 42% in 2013. It believes those two markets will generate long-term tailwinds as factories rely more on automation and Internet of Things (IoT) devices, and cars add more chips to their infotainment and driverless systems.  Unfortunately, the pandemic disrupted many industrial companies and shut down major automakers. The company couldn t fully offset that slowdown with stronger sales of chips for personal electronics and healthcare customers, and its total revenue dipped 6% year-over-year to $10.39 billion in the first nine months of the year.  But on the bright side, TI s constant buybacks boosted its EPS 1% even as its gross and operating margins contracted. Analysts expect its revenue and earnings to decline 7% and 1%, respectively, before rebounding with single-digit growth rates next year.  TI s near-term prospects seem dimmer than Lumentum s, but investors should keep two things in mind. First, TI s ongoing shift from 200mm to 300mm wafers, which cuts production costs by about 40%, should buoy its gross margins after the pandemic passes.  Second, the company remains committed to returning most of its free cash flow to shareholders via dividends and buybacks. It s raised its dividend annually for 17 straight years, currently pays a forward yield of 2.7%, and reduced its share count by nearly 50% over the past 16 years. Lumentum doesn t pay a dividend, and it rarely repurchases any shares.  The valuations and verdict  Lumentum trades at just 15 times forward earnings, but TI has a much higher forward P/E ratio of 26. Investors are likely paying a premium for TI because they consider it a good defensive play for a volatile market, but it s a bit pricey relative to its near-term growth.  Lumentum isn t as well-diversified as TI, but it s sitting on multiple catalysts -- including the expansion of the 5G market, the use of LiDARs in driverless cars, and the iPhone 12 -- and trading at a low valuation. Therefore, I firmly believe Lumentum will continue to outperform TI over the next few quarters."
52,2020-10-27,12:20:00,AAPL,https://www.investors.com/market-trend/stock-market-today/dow-jones-slips-nasdaq-rises-after-monday-market-rout-microsoft-earnings/?src=A00220,"Dow Jones Slips, Nasdaq Rises After Monday's Market Rout; Microsoft Earnings Ahead","Stocks were mixed midday Tuesday, after Monday s big sell-off. The Dow Jones Industrial Average reversed lower after an early gain.  X  The Dow Jones industrials slid 0.3%, the S&P 500 was flat, and the Nasdaq rose 0.7% in the stock market today. Small caps tracked by the Russell 2000 fell 0.5%. Volume was lower on both major exchanges vs. the same time Monday.  Amid recent volatility, the Nasdaq holds a 27% year-to-date gain, while the S&P 500 was up 5% through Monday s close. The Dow is down 3% and the Russell 2000 is now 2% underwater this year. Read The Big Picture for detailed daily market analysis.  The Dow Jones index, which wrapped up September with a 2.3% loss, has fallen below its 50-day moving average. On Sept. 30, the IBD stock market outlook was upgraded to ""confirmed uptrend"" from ""market in correction."" But on Monday, the outlook was downgraded to ""uptrend under pressure"" as stocks sold off.  Covid-19 Update  Worldwide coronavirus cases have topped 43.9 million, with nearly 1.17 million deaths, according to Worldometer. In the U.S., confirmed cases are now close to 9 million, with the death toll over 231,000. New virus cases hit record highs on Friday and Saturday in the U.S., topping 80,000 each day.  U.S. Stock Market Today Overview Index Symbol Price Gain/Loss % Change Dow Jones (0DJIA) 27591.70 -93.68 -0.34 S&P 500 (0S&P5) 3400.68 -0.29 -0.01 Nasdaq (0NDQC ) 11436.90 +77.96 +0.69 Russell 2000 (IWM) 158.79 -0.76 -0.48 IBD 50 (FFTY) 37.70 +0.22 +0.59 Last Update: 11:58 AM ET 10/27/2020  As the race toward a coronavirus vaccine or treatment heats up, Novavax (NVAX) surged 5% in above-average trade. The biotech said it s expanding its Phase 2/3 clinical trial in the U.K. to 15,000 participants from 10,000. Novavax also expects to start a Phase 3 trial in the U.S. by the end of November.  Shares have been stuck below their 50-day moving average the past two months and are 27% off their 52-week high. But Novavax has rallied more than 2,000% this year.  In other Covid-19 news, Moderna (MRNA) said the U.K. has begun reviewing its Covid-19 vaccine candidate. The biotech s stock rose 1% early before reversing to a 1% loss.  Pfizer (PFE) and partner BioNTech (BNTX) said they could have final-phase data next month and seek emergency approval this year. Both stocks traded about 1% lower.  Dow Winners And Losers  Caterpillar (CAT) weighed on the Dow Jones index with a 3% drop in busy trade. The heavy-equipment maker reported a Q3 profit of $1.34 a share on $9.9 billion in revenue, topping Zacks  forecast for $1.15 EPS on sales of $9.67 billion.  Caterpillar once again did not provide earnings guidance. Shares are extended from a 146.30 buy point of a cup with handle.  Boeing (BA) and Intel (INTC) were among other blue chips down nearly 2%.  Salesforce.com (CRM) led the upside on the Dow with a 3% gain as it tries to retake its 50-day line, which it gave up on Monday. The stock is building a shallow base with a 284.60 buy point, according to MarketSmith chart analysis.  Other Dow winners with a 1% or better gain included Apple (AAPL), Microsoft (MSFT) and Procter & Gamble (PG).  Apple, up 1.4%, is trying to reclaim its 50-day line. It s working on the right side of a new cup-with-handle base with a 125.49 buy point. The iPhone maker s stock has rallied nearly 60% through Monday s close.  Microsoft advanced 1% ahead of its earnings after the close. The IBD Leaderboard stock is shaping a new cup with handle, with a 225.31 buy point. It s up more than 30% this year. Analysts expect the software giant to earn $1.53 a share on $35.67 billion in sales. That would mark an 11% increase in EPS and an 8% bump in sales.  AMD, Chegg Pressure The IBD 50  Outside the Dow, Advanced Micro Devices (AMD) topped Q3 views with adjusted earnings of 41 cents a share on $2.8 billion revenue. The chipmaker also announced it s buying Xilinx (XLNX) for $35 billion. The all-stock deal is expected to close at the end of 2021. AMD shares fell 3%, while Xilinx soared 10%.  AMD weighed on the IBD 50, as did Chegg (CHGG). Online education stock Chegg plunged 10% in heavy volume despite reporting Q3 results that topped views on both the top and bottom lines. It also offered strong guidance for the rest of this year and next year.  Chegg stock is shaping a cup base with an 89.92 buy point. It may form a handle after today s drop.  But the Innovator IBD 50 ETF (FFTY) climbed 0.6%, thanks to upside moves from China stocks Futu Holdings (FUTU) and Alibaba (BABA). Software leaders Atlassian (TEAM), Workday (WDAY) and Veeva Systems (VEEV) added about 2% each.  Follow Nancy Gondo on Twitter at @IBD_NGondo  YOU MAY ALSO LIKE:  Top Coronavirus Stock Near Buy Point After Blowout Quarter  Best Growth Stocks To Buy And Watch  Start Building Your Watchlist Now: Find Top Stocks In Leaderboard Today  IBD Live: Learn Top Chart-Reading And Trading Techniques From The Pros  These 4 Stocks Struggle At Early Buy Points, But This Is The Real Problem"
53,2020-10-27,12:09:00,AAPL,https://www.barrons.com/articles/corning-stock-slips-despite-solid-earnings-51603814971?siteid=yhoof2,Corning Stock Slips Despite Solid Earnings,"Text size  Corning shares are sagging on Tuesday despite a better-than-expected third-quarter earnings report from the specialty glass manufacturer.  For the quarter, the company posted “core” sales of $3 billion, up 1% from a year ago and 16% sequentially, and a bit above the Street consensus at $2.93 billion. Non-GAAP earnings were 43 cents a share, ahead of the Wall Street analyst consensus at 36 cents.  “Sales and operating income grew on improving demand and commercialization of our innovations,” Corning CEO Wendell Weeks said in a statement. “In all the industries we serve, important market trends are offering new opportunities that we’re uniquely qualified to address.”  Weeks added that while Corning’s markets “continue to flash green,” the company is “keeping a tight focus on cost and manufacturing execution.”  The strongest sector in the quarter was Specialty Materials, where sales were up 23%, driven in part by Apple’s adoption of the company’s new “ceramic shield” display material included in the new iPhone 12, and highlighted in Apple’s recent launch event. The company also noted that Samsung is using the latest version of the company’s Gorilla Glass displays in the Galaxy Note20 Ultra smartphone.  Sales were up 4% year-over-year in display technologies, which mostly supplies television manufacturers. The company said that price declines “were moderate” in the quarter. On a year-over-year basis, sales were down 10% in optical communications, off 5% in environmental technologies, and down 13% in life sciences.  Corning didn’t provide fourth-quarter financial guidance.  Corning shares were down 1.9% to $33.60 in recent trading.  Write to Eric J. Savitz at eric.savitz@barrons.com"
